<!-- Created for the TLOS Scheduler http://www.likyateknoloji.com -->
<trc:TlosTraceData xmlns:trc="http://www.likyateknoloji.com/XML_trace_types" xmlns:com="http://www.likyateknoloji.com/XML_common_types" xmlns:xsi="http://www.w3.org/2001/XMLSchema-instance" xsi:schemaLocation="http://www.likyateknoloji.com/XML_trace_types xmldb:exist:///db/TLOSSW/xsds/tlosSWTrace_v_1_0.xsd">
    <trc:trace id="1">
        <trc:trcTime millis="1084224175321">2004-05-10 17:22:55.321-01:00</trc:trcTime>
        <trc:trcUser id="12" password="1234" role="admin">Hasan</trc:trcUser>
        <trc:trcUserAgent ip="192.168.1.1">Mozilla/5.0 (Windows; U; Windows NT 6.0; en-US; rv:1.9.0.19) Gecko/2010031422 Firefox/3.0.19 (.NET CLR 3.5.30729)</trc:trcUserAgent>
        <trc:trcSource javaProject="TlosEntWeb" package="com.likya.tlos.appmng.workspace" class="ScenarioMBean.java" method="jobInsertAction">tlos.login.invalidLogin</trc:trcSource>
        <trc:componentId>JobInsertButton</trc:componentId>
        <trc:description>job id="18" name="job10" path="freeJobs"</trc:description>
    </trc:trace>
</trc:TlosTraceData>